id,slug,name,price,vigor,size,load,speed,description
631b7598-fc52-4105-8920-d17b1747a395,ane-mule,Âne ou mule,8,2,Medium,140,1,Mammifère à longueur oreilles et à l’échine saillante utilisé comme bête de somme.
46602df1-6d61-44b6-8825-85095ebaaab1,chameau,Chameau,50,3,Large,,1,Monture et bête de somme dans les régions arides et désertiques.
c74d57dd-6a99-4a09-b04e-879282612ad8,cheval-de-course,Cheval de course,75,3,Large,,1,"Plus dispendieux que le cheval de trait, ce type de cheval est plutôt adapté au voyage. Sa réaction première face au danger est la fuite, emportant avec lui son cavalier. Une fois par jour, il peut parcourir 2 lieues en une heure en alternant les allures (marche, trot, petit galop et galop), ce qui permet de réduire la distance de voyages ou d’esquiver certaines escarmouches."
89b7ac92-e9d7-4edb-89d2-4a81cf7a01aa,cheval-de-guerre,Cheval de guerre,400,4,Large,,1,"Le plus dispendieux des types de chevaux, ce cheval est néanmoins la meilleure option au combat. Sa réaction première face au danger est de rester en position. Tout comme le cheval de trait, il peut parcourir une plus grande distance une fois par jour. Il peut également charger et est formé au port de la barde, un ensemble de pièces d’armure désignées pour les chevaux."
d3557e34-5d8f-4550-88b3-dd19309a52f3,cheval-de-trait,Cheval de trait,50,4,Large,,1,"Le type de cheval le moins dispendieux. On l’utilise principalement pour le travail agricole et pour tirer des véhicules terrestres. Face au danger, il n’est pas d’une grande aide, sa réaction première étant de figer."
66d41626-92e7-49fd-b03e-80116b5e11f4,elephant,Éléphant,200,6,Huge,,1.5,"Un énorme mammifère exotique, originaire de contrées lointaines. Il est utilisé à la guerre pour sa taille intimidante."
6315df60-273f-452a-9b65-6a7d10fdbaf3,mastiff,Mastiff,25,1,Medium,,1,"Un loyal compagnon prisé pour ses sens aiguisés et sa polyvalence. Il peut être entraîné comme gardien, combattant et chasseur."
cfae655a-4e19-4732-9893-b29bb3af35b4,poney,Poney,30,2,Medium,,1,"Un cheval de petite taille, adapté pour un cavalier de petite taille ou pour tirer un petit véhicule."
